{
  "metadata": {
    "case_name": "Appellant Company (successors of Messrs Bird & Co.) v. Raja of Ramgarh",
    "case_year": 1956,
    "court": "Supreme Court of India",
    "judges": [
      "Venkatarama Aiyar J."
    ],
    "case_number": "Civil Appeals Nos. 191 and 192 of 1953",
    "date_of_judgment": "1956-04-10"
  },
  "facts": [
    {
      "id": "f1",
      "text": "Ramgarh Raj is an ancient principality in Bihar with three coalfields: Bokaro Jharia, Bokaro Ramgarh and Karanpura (largest, 550 sq. miles, 415 sq. miles belonging to estate).",
      "type": "background",
      "date": null,
      "source": "court"
    },
    {
      "id": "f2",
      "text": "On 26-11-1907, Raja Ramnarain Singh granted prospecting license for Bokaro Ramgarh coalfields to Messrs Anderson Wright Co. (Bokaro license).",
      "type": "background",
      "date": "1907-11-26",
      "source": "court"
    },
    {
      "id": "f3",
      "text": "Raja Ramnarain Singh negotiating similar license for Karanpura coalfields (Exhibit 155-b dated 1-12-1912), died on 26-1-1913 leaving widow Rikinath Kaur and minor son Lakshminarain Singh. Estate debts about Rs. 9 lakhs.",
      "type": "background",
      "date": "1913-01-26",
      "source": "court"
    },
    {
      "id": "f4",
      "text": "On 20-5-1913, Court of Wards took over management of estate to relieve debts.",
      "type": "procedural",
      "date": "1913-05-20",
      "source": "court"
    },
    {
      "id": "f5",
      "text": "Messrs Bird & Co. applied for prospecting license for Karanpura coalfields. Manager informed on 4-9-1913 of condition for advance Rs. 8-11 lakhs.",
      "type": "material",
      "date": "1913-09-04",
      "source": "court"
    },
    {
      "id": "f6",
      "text": "Negotiations over months; terms agreed 29-7-1914; prospecting license executed 26-3-1915 for 6 years. Salami Rs.1,00,000; minimum ground rent Rs.8,000 p.a. from year 2; lease terms: salami Rs.40/bigha, royalty min Rs.5/bigha, pay cesses as occupier/tenant. Advance Rs.9 lakhs loan interest-free, adjusted against royalties or repaid with 4.5% interest in 6 years if abandoned. Mortgage bond same date.",
      "type": "material",
      "date": "1915-03-26",
      "source": "court"
    },
    {
      "id": "f7",
      "text": "On 3-8-1915, Messrs Bird & Co. applied for extension due to war conditions.",
      "type": "material",
      "date": "1915-08-03",
      "source": "court"
    },
    {
      "id": "f8",
      "text": "Deed dated 23-11-1917 modifying 1915 license: extended to 12 years (to 26-3-1927); further 12 years to 1939 if 10,000 bighas leased; another 12 to 1951 if 20,000 bighas by 1939. Minimum ground rent Rs.50,000 p.a. (Rs.5/bigha on 10,000 bighas) years 7-12.",
      "type": "material",
      "date": "1917-11-23",
      "source": "court"
    },
    {
      "id": "f9",
      "text": "Raja Lakshminarain Singh major on 6-4-1919, died 10-4-1919 leaving minor son Raja Kamakshya Narain Singh. Court of Wards continued management till 10-8-1937.",
      "type": "background",
      "date": "1919-04-06",
      "source": "court"
    },
    {
      "id": "f10",
      "text": "Appellant Company registered 14-7-1920 under Indian Companies Act, took over Bird & Co. interests under 1915 license as modified 1917.",
      "type": "procedural",
      "date": "1920-07-14",
      "source": "court"
    },
    {
      "id": "f11",
      "text": "Company took six leases totaling 17,539 bighas between 17-7-1922 and 17-7-1933.",
      "type": "material",
      "date": null,
      "source": "court"
    },
    {
      "id": "f12",
      "text": "To meet 20,000 bighas, obtained three leases 2-8-1937 for 2,461 bighas.",
      "type": "material",
      "date": "1937-08-02",
      "source": "court"
    },
    {
      "id": "f13",
      "text": "Deed 1-6-1937 modifying clause 6 of 1917 deed: minimum royalty on excess over 10,000 bighas postponed till railway facilities or 26-3-1951.",
      "type": "material",
      "date": "1937-06-01",
      "source": "court"
    },
    {
      "id": "f14",
      "text": "Raja major 10-8-1937, assumed management.",
      "type": "procedural",
      "date": "1937-08-10",
      "source": "court"
    },
    {
      "id": "f15",
      "text": "Raja notice 9-3-1939 repudiating 1915 license and 1917, 1937 deeds.",
      "type": "procedural",
      "date": "1939-03-09",
      "source": "respondent"
    },
    {
      "id": "f16",
      "text": "Appellant notice 14-5-1940 for lease of 250 bighas; filed Title Suit No.28/1940 on 8-6-1940 for specific performance.",
      "type": "procedural",
      "date": "1940-06-08",
      "source": "petitioner"
    },
    {
      "id": "f17",
      "text": "Raja filed Title Suit No.82/1940 on 9-8-1940 declaring deeds void, possession, mesne profits.",
      "type": "procedural",
      "date": "1940-08-09",
      "source": "respondent"
    },
    {
      "id": "f18",
      "text": "Subordinate Judge Hazaribagh 30-4-1943: 1915 and 1917 deeds valid, 1937 invalid; specific performance in 28/1940, partial relief in 82/1940.",
      "type": "procedural",
      "date": "1943-04-30",
      "source": "lower_court"
    },
    {
      "id": "f19",
      "text": "Patna HC appeals F.A.125/1943 and 127/1943: All three deeds invalid, leases void; dismissed suit 28 and cross-objections.",
      "type": "procedural",
      "date": "1949-10-27",
      "source": "lower_court"
    },
    {
      "id": "f20",
      "text": "Estate vested in State of Bihar under Bihar Land Reforms Act; State intervened, accepted leases.",
      "type": "procedural",
      "date": null,
      "source": "court"
    }
  ],
  "legal_issues": [
    {
      "id": "i1",
      "text": "Validity of prospecting license dated 26-3-1915 granted by Court of Wards.",
      "framed_by": "court"
    },
    {
      "id": "i2",
      "text": "Validity of deed dated 23-11-1917 modifying the 1915 license.",
      "framed_by": "court"
    },
    {
      "id": "i3",
      "text": "Validity of deed dated 1-6-1937 further modifying terms.",
      "framed_by": "court"
    },
    {
      "id": "i4",
      "text": "Scope of section 18 Bengal Court of Wards Act: whether Court's judgment on benefit conclusive or subject to judicial review on merits.",
      "framed_by": "court"
    },
    {
      "id": "i5",
      "text": "Whether sanction under section 18 obtained for 1917 and 1937 deeds.",
      "framed_by": "court"
    }
  ],
  "petitioner_arguments": [
    {
      "id": "pa1",
      "text": "Court of Wards applied mind to cess clause in 1915 deed; difference from Bokaro license formal, not substantive; cess per Bengal Cess Act shared.",
      "supporting_facts": [
        "f2",
        "f6"
      ],
      "legal_basis": "Bengal Cess Act ss.80,81"
    },
    {
      "id": "pa2",
      "text": "Section 18 confers power on Court of Wards to judge benefit; honest judgment not reviewable on merits.",
      "supporting_facts": [
        "f6",
        "f8"
      ],
      "legal_basis": "Bengal Court of Wards Act s.18"
    },
    {
      "id": "pa3",
      "text": "1917 deed within powers; not tying hands unduly; mutual obligations, not gift; considered estate benefit.",
      "supporting_facts": [
        "f7",
        "f8"
      ],
      "legal_basis": "Bengal Court of Wards Act s.18"
    },
    {
      "id": "pa4",
      "text": "Sanction for 1917 deed via Board letters 3-7-1916 and 9-10-1917 covering essentials.",
      "supporting_facts": [
        "f8"
      ],
      "legal_basis": "Bengal Court of Wards Act s.18; Gulabsingh v. Seth Gokuldas; Ramkanai Singh v. Mathewson"
    },
    {
      "id": "pa5",
      "text": "1937 leases valid even if proviso void; severable; sanction pre-dates execution.",
      "supporting_facts": [
        "f12",
        "f13"
      ],
      "legal_basis": "Bengal Court of Wards Act s.18"
    }
  ],
  "respondent_arguments": [
    {
      "id": "ra1",
      "text": "1915 deed not beneficial due to cess clause less advantageous than Bokaro license; Court of Wards did not apply mind.",
      "supporting_facts": [
        "f2",
        "f6"
      ],
      "legal_basis": "Bengal Court of Wards Act s.18"
    },
    {
      "id": "ra2",
      "text": "1917 deed beyond power: ties estate for 32 years post-majority, binds to old rates till 1951; not beneficial.",
      "supporting_facts": [
        "f8",
        "f9"
      ],
      "legal_basis": "Bengal Court of Wards Act s.18"
    },
    {
      "id": "ra3",
      "text": "Court of Wards considered only Bird & Co. benefit and public interest, not ward's.",
      "supporting_facts": [
        "f7"
      ],
      "legal_basis": "Bengal Court of Wards Act s.18"
    },
    {
      "id": "ra4",
      "text": "No sanction for 1917 deed as required by s.18.",
      "supporting_facts": [
        "f8"
      ],
      "legal_basis": "Bengal Court of Wards Act s.18"
    },
    {
      "id": "ra5",
      "text": "1937 deed and leases invalid for lack of sanction and not beneficial.",
      "supporting_facts": [
        "f13"
      ],
      "legal_basis": "Bengal Court of Wards Act s.18"
    }
  ],
  "court_reasoning": [
    {
      "id": "cr1",
      "text": "Under s.18, Court of Wards' judgment on benefit conclusive if bona fide and mind applied; not reviewable on merits. Words 'as it may judge' confer authority to Court of Wards, not objective test.",
      "addresses_issue": "i4",
      "key_observation": "Statute confides judgment to Court of Wards; challenge only for fraud or non-application of mind."
    },
    {
      "id": "cr2",
      "text": "Court of Wards applied mind to cess clause: appeared in draft, altered by Lister, approved by Mitra and Board.",
      "addresses_issue": "i1",
      "key_observation": "Cess clause per Cess Act; even if less advantageous, decision not reviewable."
    },
    {
      "id": "cr3",
      "text": "1917 deed within s.18 powers: no limit on term tied to minority; managed as prudent owner; mutual obligations; considered estate benefit (long-term working, war conditions).",
      "addresses_issue": "i2",
      "key_observation": "No evidence rates unmarket; point not pleaded."
    },
    {
      "id": "cr4",
      "text": "Board sanctioned 1917 deed essentials via 3-7-1916 (general) and 9-10-1917 (after legal review); formal changes post not needed.",
      "addresses_issue": "i5",
      "key_observation": "Sanction to transaction essentials sufficient per precedents."
    },
    {
      "id": "cr5",
      "text": "1937 deed invalid (conceded); but 1937 leases valid, proviso severable; sanction covers.",
      "addresses_issue": "i3",
      "key_observation": "Void clause does not void whole lease."
    }
  ],
  "holdings": [
    {
      "id": "h1",
      "text": "Deed 26-3-1915 valid; Court of Wards applied mind, judgment conclusive.",
      "resolves_issue": "i1",
      "in_favor_of": "petitioner"
    },
    {
      "id": "h2",
      "text": "Deed 23-11-1917 valid; within powers, beneficial, sanctioned.",
      "resolves_issue": "i2",
      "in_favor_of": "petitioner"
    },
    {
      "id": "h3",
      "text": "Deed 1-6-1937 invalid.",
      "resolves_issue": "i3",
      "in_favor_of": "respondent"
    },
    {
      "id": "h4",
      "text": "Leases valid, except postponement clause in 2-8-1937 leases inoperative.",
      "resolves_issue": "i3",
      "in_favor_of": "partial"
    },
    {
      "id": "h5",
      "text": "s.18 protects if bona fide judgment by Court of Wards.",
      "resolves_issue": "i4",
      "in_favor_of": "petitioner"
    }
  ],
  "precedents_cited": [
    {
      "case_name": "Nakkuda Ali v. M.F. De S. Jayaratne",
      "citation": "1951 A.C. 66",
      "treatment": "referred",
      "relevance": "Construction of words importing reasonable grounds vs subjective judgment."
    },
    {
      "case_name": "Liversidge v. Sir John Anderson",
      "citation": "1942 A.C. 206",
      "treatment": "distinguished",
      "relevance": "Words like 'reasonable cause to believe' objective; contrasts with s.18 subjective judgment."
    },
    {
      "case_name": "Allcroft v. Lord Bishop of London",
      "citation": "1891 A.C. 666",
      "treatment": "followed",
      "relevance": "Limits on judicial interference with honest statutory judgment."
    },
    {
      "case_name": "Gulabsingh v. Seth Gokuldas",
      "citation": "1913 L.R. 40 I.A. 117",
      "treatment": "followed",
      "relevance": "Sanction to essentials of transaction sufficient under s.18, not precise deed."
    },
    {
      "case_name": "Ramkanai Singh Deb Darpashaha v. Mathewson",
      "citation": "1915 L.R. 42 I.A. 97",
      "treatment": "followed",
      "relevance": "Sanction to transaction essentials ok even if final deed not resubmitted."
    },
    {
      "case_name": "Ashutosh Dhar v. Amir Mollah",
      "citation": "1900 3 Cal. L.J. 337",
      "treatment": "referred",
      "relevance": "Parties can contract out of Cess Act s.41."
    },
    {
      "case_name": "Mahanand Sahai v. Mussmat Sayedunissa Bibi",
      "citation": "1907 12 C.W.N. 154",
      "treatment": "followed",
      "relevance": "Strict construction against exemption from statutory cess liability."
    },
    {
      "case_name": "Balwantrao Naik v. Biswanath Missir",
      "citation": "A.I.R. 1945 Patna 417",
      "treatment": "followed",
      "relevance": "Cess clause not contracting out of statute."
    },
    {
      "case_name": "Ramkumari Devi v. Hari Das",
      "citation": "A.I.R. 1952 Patna 239",
      "treatment": "followed",
      "relevance": "Cess clause not contracting out of statute."
    },
    {
      "case_name": "Connecticut Fire Insurance Co. v. Kavanagh",
      "citation": "1892 A.C. 473",
      "treatment": "followed",
      "relevance": "New factual points not raisable without evidence."
    },
    {
      "case_name": "M.E. Moolla Sons Ltd. v. Burjorjee",
      "citation": "1932 L.R. 59 I.A. 161",
      "treatment": "followed",
      "relevance": "New factual points not raisable without evidence."
    }
  ],
  "statutes_cited": [
    {
      "name": "Bengal Court of Wards Act IX of 1879",
      "sections": [
        "Section 14",
        "Section 18"
      ],
      "relevance": "Powers of Court of Wards to manage estate and sanction acts for benefit; judgment conclusive if bona fide."
    },
    {
      "name": "Bengal Cess Act IX of 1880",
      "sections": [
        "Section 80",
        "Section 81"
      ],
      "relevance": "Cess on mines shared equally by owner and lessee."
    },
    {
      "name": "Guardians and Wards Act VIII of 1890",
      "sections": [
        "Section 29"
      ],
      "relevance": "Contrasted: limits leases to minority period, unlike Court of Wards Act."
    },
    {
      "name": "Indian Companies Act",
      "sections": [],
      "relevance": "Appellant company registration."
    },
    {
      "name": "Bihar Land Reforms Act XXX of 1950",
      "sections": [
        "Section 3(1)"
      ],
      "relevance": "Vesting of estate in State of Bihar."
    }
  ],
  "outcome": {
    "disposition": "accepted",
    "summary": "Supreme Court allowed appeals, set aside Patna High Court decrees, restored Subordinate Judge decrees. Held 1915 and 1917 deeds valid, 1937 deed invalid; leases valid except minimum royalty postponement clause in 1937 leases inoperative. Specific performance decreed; possession/mesne profits denied.",
    "relief_granted": "Specific performance of leases per 1915/1917 deeds; costs to appellant in C.A.191/1953.",
    "costs": "Appellant costs in C.A.191/1953 throughout; parties bear own in C.A.192/1953."
  },
  "key_quotes": [
    {
      "text": "\"The statute confides in clear and unambiguous terms the authority to judge whether the act is beneficial to the estate, to the Court of Wards and not to any outside authority.\"",
      "speaker": "court",
      "significance": "Core holding on scope of s.18; judgment not reviewable on merits."
    },
    {
      "text": "\"A transaction entered into by a guardian on behalf of a minor will be valid and binding on the latter, only if it is for proved necessity or benefit. [...] The Court of Wards is not in the same position as a guardian of a minor.\"",
      "speaker": "court",
      "significance": "Distinguishes Court of Wards statutory powers from natural guardian."
    },
    {
      "text": "\"If a man is to form an opinion, and his opinion is to govern, he must form it himself on such reasons and grounds as seem good to him.\" (Lord Bramwell)",
      "speaker": "court",
      "significance": "Limits judicial review of honest statutory discretion."
    }
  ],
  "_case_id": "1956_36",
  "_label": 1,
  "_text_length": 64121,
  "_extracted_at": "2026-02-08T22:12:58.651269"
}