{
  "metadata": {
    "case_name": "Appellant v. State",
    "case_year": 1970,
    "court": "Supreme Court of India",
    "judges": [
      "Alagiriswami, J."
    ],
    "case_number": "Criminal Appeal No. 14 of 1970",
    "date_of_judgment": null
  },
  "facts": [
    {
      "id": "f1",
      "text": "Appellant is a partner of a firm owning the New India Knitting Mills in Amritsar, with a sister concern J. D. Woollen and Silk Mills owned by a partnership firm of which appellant's minor son is a partner.",
      "type": "background",
      "date": null,
      "source": "court"
    },
    {
      "id": "f2",
      "text": "On 10-10-1963, J. D. Mills was given an import licence for Rs. 23,480/- for spare parts for Warp Knitting Machine from Germany.",
      "type": "material",
      "date": "1963-10-10",
      "source": "court"
    },
    {
      "id": "f3",
      "text": "Goods valued at Rs. 11,699/- arrived in Bombay on 16.3.1964.",
      "type": "material",
      "date": "1964-03-16",
      "source": "court"
    },
    {
      "id": "f4",
      "text": "J.D. Mills arranged clearance through New Suraj Transit Company; Hiro Shahani, employee of clearing agents, became approver.",
      "type": "procedural",
      "date": null,
      "source": "court"
    },
    {
      "id": "f5",
      "text": "Bakubhai Ambalal Co. were representatives in India of the machinery manufacturing company.",
      "type": "background",
      "date": null,
      "source": "court"
    },
    {
      "id": "f6",
      "text": "In July 1963, anonymous petition against the two mills; on 21.11.1963, order by Principal Appraiser for careful watch over imports.",
      "type": "background",
      "date": "1963-07-01",
      "source": "court"
    },
    {
      "id": "f7",
      "text": "On 30-3-1964, J. D. Mills complained to Deputy Collector about delays; appellant met Deputy Collector protesting scrutiny.",
      "type": "material",
      "date": "1964-03-30",
      "source": "court"
    },
    {
      "id": "f8",
      "text": "Bill of Entry prepared on 4-6-1964; sent to Special Investigation Branch and back.",
      "type": "procedural",
      "date": "1964-06-04",
      "source": "court"
    },
    {
      "id": "f9",
      "text": "Motwani (PW6) examined goods, opined not spare parts but machine in assembled condition; Shed Appraiser agreed.",
      "type": "material",
      "date": null,
      "source": "court"
    },
    {
      "id": "f10",
      "text": "Clearing agents telephoned appellant, who asked for re-examination; Shahani requested Principal Appraiser Almeida.",
      "type": "material",
      "date": null,
      "source": "court"
    },
    {
      "id": "f11",
      "text": "Vazirani re-examined, reported; approved by Menon, then Merchant recommended show cause notice for mis-declaration; Almeida approved 9-7-1964; notice issued 17-7-1964.",
      "type": "material",
      "date": "1964-07-09",
      "source": "court"
    },
    {
      "id": "f12",
      "text": "Appellant reached Bombay on 1-7-1964.",
      "type": "material",
      "date": "1964-07-01",
      "source": "court"
    },
    {
      "id": "f13",
      "text": "Towards end of July 1964, Central Intelligence Unit constituted; Ramachandra Rao (PW3) transferred, inspected goods 1-8-1964.",
      "type": "procedural",
      "date": "1964-08-01",
      "source": "court"
    },
    {
      "id": "f14",
      "text": "On 4-9-1964, directed to search Bakubhai Ambalal, who produced documents.",
      "type": "procedural",
      "date": "1964-09-04",
      "source": "court"
    },
    {
      "id": "f15",
      "text": "Appellant asked Shahani on 4th to introduce to Rao; introduction made.",
      "type": "material",
      "date": null,
      "source": "court"
    },
    {
      "id": "f16",
      "text": "On 13-8-1964, appellant met Rao at Gaylord restaurant; alleged offer of bribe Rs. 5000/-; Rao reported to Sonavne at 1.30 p.m.",
      "type": "disputed",
      "date": "1964-08-13",
      "source": "prosecution"
    },
    {
      "id": "f17",
      "text": "On 14-8-1964, appellant and Shahani met Rao at Gaylord; appellant passed two envelopes containing Rs. 2500/- each; Jog recovered them.",
      "type": "material",
      "date": "1964-08-14",
      "source": "prosecution"
    },
    {
      "id": "f18",
      "text": "PWs 4 and 5 (Income-tax officers) overheard as panch witnesses.",
      "type": "procedural",
      "date": "1964-08-14",
      "source": "court"
    },
    {
      "id": "f19",
      "text": "Charge-sheet filed 30-10-1964; Shahani arrested 24-11-1964, released on bail; statement January 1965, confession 19-3-1965; pardon granted 15-4-1965.",
      "type": "procedural",
      "date": "1964-10-30",
      "source": "court"
    },
    {
      "id": "f20",
      "text": "Appellant convicted by Special Judge under S. 165-A IPC, RI 1 year, fine Rs.10,000; High Court upheld conviction, reduced RI to 6 months.",
      "type": "procedural",
      "date": "1969-09-24",
      "source": "court"
    },
    {
      "id": "f21",
      "text": "Shahani applied for reward 21-5-1965, received Rs.500, Rs.500, Rs.350 on 7-6-1965; applied for clearing agent licence.",
      "type": "disputed",
      "date": "1965-05-21",
      "source": "court"
    },
    {
      "id": "f22",
      "text": "Appellant applied for production of documents on 20-9-1965 and 22-9-1965; dismissed by Special Judge.",
      "type": "procedural",
      "date": "1965-09-20",
      "source": "court"
    },
    {
      "id": "f23",
      "text": "High Court on 11-6-1968 allowed portions of CIU file (Ex.67,68); Shahani and Rao re-examined.",
      "type": "procedural",
      "date": "1968-06-11",
      "source": "court"
    }
  ],
  "legal_issues": [
    {
      "id": "i1",
      "text": "Whether the appellant made an offer of bribe to Rao on 13-8-1964 and gave the bribe on 14-8-1964.",
      "framed_by": "court"
    },
    {
      "id": "i2",
      "text": "Whether evidence of Rao and Shahani is reliable, considering conspiracy allegations and privilege claims under Evidence Act.",
      "framed_by": "court"
    },
    {
      "id": "i3",
      "text": "Whether production of CIU file documents affects the prosecution case.",
      "framed_by": "court"
    },
    {
      "id": "i4",
      "text": "Question of sentence reduction.",
      "framed_by": "court"
    }
  ],
  "petitioner_arguments": [
    {
      "id": "pa1",
      "text": "No meeting between appellant and Rao on 13-8-1964; charge result of conspiracy between Rao (to advance career) and Shahani (for reward and licence).",
      "supporting_facts": [
        "f16",
        "f21",
        "f22",
        "f23"
      ],
      "legal_basis": "ss. 124 and 125 Evidence Act"
    },
    {
      "id": "pa2",
      "text": "Appellant asked for papers on two consignments, but Shahani brought envelopes with currency notes; reaction consistent with innocence.",
      "supporting_facts": [
        "f17"
      ],
      "legal_basis": null
    },
    {
      "id": "pa3",
      "text": "Rao's evidence contradictory to panchnama and PWs 4,5; Madanlal not in Bombay.",
      "supporting_facts": [
        "f17",
        "f18"
      ],
      "legal_basis": null
    },
    {
      "id": "pa4",
      "text": "Bribe offered only to avoid harassment; reconsidered payment post-clearance.",
      "supporting_facts": [
        "f20"
      ],
      "legal_basis": null
    }
  ],
  "respondent_arguments": [
    {
      "id": "ra1",
      "text": "Appellant offered bribe on 13-8-1964 and gave on 14-8-1964; corroborated by panchnama and PWs.",
      "supporting_facts": [
        "f16",
        "f17",
        "f18"
      ],
      "legal_basis": null
    }
  ],
  "court_reasoning": [
    {
      "id": "cr1",
      "text": "High Court order allowing portions of CIU file incorrect as it contravenes s.124 Evidence Act; does not affect merits as documents do not impinge on guilt.",
      "addresses_issue": "i2",
      "key_observation": "Privilege under ss.123-125 Evidence Act; no need to overrule in this case."
    },
    {
      "id": "cr2",
      "text": "Shahani's informer role and reward do not affect core issue of bribe offer and payment.",
      "addresses_issue": "i1",
      "key_observation": "Crucial question is events of 13th and 14th August 1964."
    },
    {
      "id": "cr3",
      "text": "Rao reported immediately to superiors; unlikely to fabricate without meeting; no motive for false implication risking Rs.5000.",
      "addresses_issue": "i1",
      "key_observation": "Evidence shows meeting on 13th occurred."
    },
    {
      "id": "cr4",
      "text": "No contradiction between Rao's evidence and panchnama/PWs 4,5; allowance for memory in crowded restaurant.",
      "addresses_issue": "i1",
      "key_observation": "Substantial consistency on bribe transaction."
    },
    {
      "id": "cr5",
      "text": "Appellant's reaction not of innocent; inconsistent story on papers/envelopes.",
      "addresses_issue": "i1",
      "key_observation": "Guilt established beyond reasonable doubt."
    },
    {
      "id": "cr6",
      "text": "No harassment; appellant trying to influence clearance of misdeclared goods.",
      "addresses_issue": "i4",
      "key_observation": "Sentence of 6 months RI appropriate; not like entrapment cases."
    }
  ],
  "holdings": [
    {
      "id": "h1",
      "text": "Appellant guilty under S.165-A IPC; conviction and sentence of 6 months RI upheld.",
      "resolves_issue": "i1",
      "in_favor_of": "respondent"
    },
    {
      "id": "h2",
      "text": "CIU file portions should not have been admitted; does not weaken prosecution.",
      "resolves_issue": "i2",
      "in_favor_of": "respondent"
    },
    {
      "id": "h3",
      "text": "No reduction in sentence below 6 months.",
      "resolves_issue": "i4",
      "in_favor_of": "respondent"
    }
  ],
  "precedents_cited": [
    {
      "case_name": "Conway v. Rimmer",
      "citation": "1968 1 All E. R. 874",
      "treatment": "referred",
      "relevance": "On scope of court powers to examine privileged documents under Evidence Act."
    },
    {
      "case_name": "Marks v. Beyfus",
      "citation": "1890 25 K. B. 494",
      "treatment": "referred",
      "relevance": "On scope of court powers to examine privileged documents."
    },
    {
      "case_name": "Ramjanam Singh v. Bihar State",
      "citation": null,
      "treatment": "distinguished",
      "relevance": "Not a case of deliberate temptation into bribery by law guardians."
    }
  ],
  "statutes_cited": [
    {
      "name": "Indian Penal Code",
      "sections": [
        "165-A"
      ],
      "relevance": "Appellant convicted for criminal misconduct by public servant in accepting bribe."
    },
    {
      "name": "Evidence Act",
      "sections": [
        "123",
        "124",
        "125"
      ],
      "relevance": "Privilege claimed for official communications; court holds s.124 contravened by disclosure."
    },
    {
      "name": "Criminal Procedure Code",
      "sections": [
        "342"
      ],
      "relevance": "Appellant's statement under s.342 CrPC."
    }
  ],
  "outcome": {
    "disposition": "dismissed",
    "summary": "Supreme Court dismissed the appeal, upheld the Bombay High Court's conviction under S.165-A IPC and sentence of 6 months rigorous imprisonment (reduced from 1 year), finding guilt established beyond reasonable doubt based on reliable evidence of bribe offer and payment.",
    "relief_granted": null,
    "costs": null
  },
  "key_quotes": [
    {
      "text": "\"The crucial question is whether the appellant did make an offer of a bribe to Rao on 13-8-1964 and did give the bribe on the 14th.\"",
      "speaker": "court",
      "significance": "Defines core issue of the case."
    },
    {
      "text": "\"We are satisfied that the conclusion arrived at by both the courts below about the appellant's guilt is correct and it has been established beyond all reasonable doubt.\"",
      "speaker": "court",
      "significance": "Final determination on guilt."
    },
    {
      "text": "\"A witness is not like a tape-recorder.\"",
      "speaker": "court",
      "significance": "Explains allowance for discrepancies in evidence recollection."
    }
  ],
  "_case_id": "1973_238",
  "_label": 0,
  "_text_length": 28732,
  "_extracted_at": "2026-02-10T20:12:55.920208"
}