{
  "metadata": {
    "case_name": "Amrit Lal Berry & Anr. v. Union of India & Ors.",
    "case_year": 1974,
    "court": "Supreme Court of India",
    "judges": [
      "BEG, J."
    ],
    "case_number": "Writ Petition Nos. 463 of 1971 and 2004 of 1973",
    "date_of_judgment": null
  },
  "facts": [
    {
      "id": "f1",
      "text": "Amrit Lal Berry appointed Inspector in Central Excise Collectorate at Delhi by orders dated 22-11-1948, posted at Ferozepur on 4-12-1948.",
      "type": "background",
      "date": "1948-11-22",
      "source": "petitioner"
    },
    {
      "id": "f2",
      "text": "Ministry of Home Affairs issued Office Memorandum dated 22-6-1949 stating seniority of existing Govt. servants determined by date of appointment and number from date of confirmation.",
      "type": "material",
      "date": "1949-06-22",
      "source": "court"
    },
    {
      "id": "f3",
      "text": "Amrit Lal Berry confirmed in permanent post under order dated 5-5-1956 with effect from 1-7-1955.",
      "type": "procedural",
      "date": "1955-07-01",
      "source": "petitioner"
    },
    {
      "id": "f4",
      "text": "Narinder Singh, matriculate, appointed 7-2-1949, confirmed retrospectively from 1-7-1953; date of birth 24-7-1911 vs. petitioner's 5-4-1925.",
      "type": "disputed",
      "date": "1953-07-01",
      "source": "petitioner"
    },
    {
      "id": "f5",
      "text": "Office Memorandum dated 22-12-1959 altered rule; seniority determined from dates of confirmation; new seniority lists prepared.",
      "type": "material",
      "date": "1959-12-22",
      "source": "court"
    },
    {
      "id": "f6",
      "text": "Seniority list issued in 1958 prepared per 1949 memo; petitioner assigned seniority accordingly.",
      "type": "admitted",
      "date": "1958",
      "source": "petitioner"
    },
    {
      "id": "f7",
      "text": "Petitioner Amrit Lal Berry given senior grade only on 8-12-1967, claims should have been from 21-3-1961.",
      "type": "disputed",
      "date": "1967-12-08",
      "source": "petitioner"
    },
    {
      "id": "f8",
      "text": "Twelve juniors promoted as Superintendents in 1970-1971 per impugned seniority list of 1-7-1967.",
      "type": "disputed",
      "date": "1970",
      "source": "petitioner"
    },
    {
      "id": "f9",
      "text": "Petitioner Amrit Lal Berry made representations dated 6-3-1965 and 13-8-1971, no replies received.",
      "type": "procedural",
      "date": "1965-03-06",
      "source": "petitioner"
    },
    {
      "id": "f10",
      "text": "Writ Petition No. 463/71 filed by Amrit Lal Berry on 9-12-1971.",
      "type": "procedural",
      "date": "1971-12-09",
      "source": "court"
    },
    {
      "id": "f11",
      "text": "N. Kapur and 14 others appointed as Inspectors from 15-5-1944 to 19-1-1950; confirmations from 1-7-1956 to 1-12-1962; senior grade entry from 29-3-1965 to 22-11-1971.",
      "type": "background",
      "date": null,
      "source": "petitioner"
    },
    {
      "id": "f12",
      "text": "K. N. Kapur seniority dropped from No. 32 to No. 252 in 1961 list.",
      "type": "disputed",
      "date": "1961",
      "source": "petitioner"
    },
    {
      "id": "f13",
      "text": "Writ Petition No. 2004/73 filed on 22-10-1973.",
      "type": "procedural",
      "date": "1973-10-22",
      "source": "court"
    },
    {
      "id": "f14",
      "text": "Office Memorandum dated 22-7-1972 issued by Dept. of Personnel interpreting Ravi Varma judgment; restores pre-1959 seniority from 4-1-1972 without disturbing prior confirmations/promotions.",
      "type": "material",
      "date": "1972-07-22",
      "source": "respondent"
    },
    {
      "id": "f15",
      "text": "Office Memoranda dated 16-3-1973 and 17-3-1973 issued by Ministry of Finance.",
      "type": "material",
      "date": "1973-03-16",
      "source": "petitioner"
    },
    {
      "id": "f16",
      "text": "Amrit Lal Berry did not pass prescribed departmental examination until November 1954; confirmed after passing on vacancy occurrence.",
      "type": "admitted",
      "date": "1954-11",
      "source": "respondent"
    },
    {
      "id": "f17",
      "text": "Union of India v. M. Ravi Varma decided on 4-1-1972 holding 1959 memo prospective, not applying to pre-1959 appointees.",
      "type": "background",
      "date": "1972-01-04",
      "source": "court"
    }
  ],
  "legal_issues": [
    {
      "id": "i1",
      "text": "Whether Office Memorandum dated 22-7-1972 correctly interprets Ravi Varma judgment and gives effect to 1949 seniority rule without violating Article 16.",
      "framed_by": "petitioner"
    },
    {
      "id": "i2",
      "text": "Whether petitioners' fundamental rights under Article 16(1) violated by seniority lists based on confirmation dates post-1959 and promotions of juniors.",
      "framed_by": "court"
    },
    {
      "id": "i3",
      "text": "Whether petitions barred by laches, acquiescence, and failure to show specific denial of equality of opportunity.",
      "framed_by": "respondent"
    }
  ],
  "petitioner_arguments": [
    {
      "id": "pa1",
      "text": "Seniority should be per 1949 memo by length of service; 1959 memo does not apply retrospectively per Ravi Varma; juniors wrongly promoted due to illegal 1967/1961 lists.",
      "supporting_facts": [
        "f1",
        "f2",
        "f3",
        "f5",
        "f8",
        "f12"
      ],
      "legal_basis": "Office Memo 22-6-1949; Union of India v. M. Ravi Varma; Article 16"
    },
    {
      "id": "pa2",
      "text": "1972 memo misinterprets Ravi Varma by not granting consequential past benefits like promotions, arrears; quash 1972, 1973 memos.",
      "supporting_facts": [
        "f14",
        "f15",
        "f17"
      ],
      "legal_basis": "Ravi Varma judgment"
    }
  ],
  "respondent_arguments": [
    {
      "id": "ra1",
      "text": "No violation of law or fundamental rights; 1972 memo balances 1949 rule with non-disturbance of past confirmations/promotions; petitions barred by laches, acquiescence, misjoinder.",
      "supporting_facts": [
        "f14",
        "f10",
        "f13",
        "f16"
      ],
      "legal_basis": "Article 16; Ravi Varma; Rabindra Nath Bose v. Union of India"
    },
    {
      "id": "ra2",
      "text": "Petitions lack specific averments of fundamental rights violation; no demand and refusal for mandamus; justifiable discrimination e.g., exam failure delayed confirmation.",
      "supporting_facts": [
        "f16"
      ],
      "legal_basis": "Article 32; Article 16(1)"
    }
  ],
  "court_reasoning": [
    {
      "id": "cr1",
      "text": "1959 memo prospective per Ravi Varma; 1972 memo restores pre-1959 seniority from 4-1-1972 without disturbing prior confirmations/promotions to protect acquired rights.",
      "addresses_issue": "i1",
      "key_observation": "1972 memo gives reasonable effect to Ravi Varma consistent with equity."
    },
    {
      "id": "cr2",
      "text": "No clear violation of Article 16(1); equality requires showing unjustifiable denial on specific occasions; petitioner's delayed confirmation due to exam failure justifiable.",
      "addresses_issue": "i2",
      "key_observation": "Confirmation not solely by length of service; other conditions apply."
    },
    {
      "id": "cr3",
      "text": "Petitions barred by inordinate delay; equitable rights accrued to promoted juniors; laches disentitles relief under Article 32.",
      "addresses_issue": "i3",
      "key_observation": "Cannot disturb long-standing promotions; Rabindra Nath Bose applies."
    }
  ],
  "holdings": [
    {
      "id": "h1",
      "text": "1972 memo constitutionally valid as interpreted: applies 1949 rule prospectively from 4-1-1972, reconsiders cases subject to vacancies, without undoing past actions.",
      "resolves_issue": "i1",
      "in_favor_of": "respondent"
    },
    {
      "id": "h2",
      "text": "No violation of Article 16(1) established; petitions fail for lack of specificity and laches.",
      "resolves_issue": "i2",
      "in_favor_of": "respondent"
    }
  ],
  "precedents_cited": [
    {
      "case_name": "Union of India v. M. Ravi Varma Ors.",
      "citation": "1972 2 S.C.R. 992",
      "treatment": "followed",
      "relevance": "1959 memo prospective; governs interpretation of 1972 memo."
    },
    {
      "case_name": "Mervyn Coutinho Ors. v. Collector of Customs, Bombay Ors.",
      "citation": "1966 3 S.C.R. 600",
      "treatment": "followed",
      "relevance": "1959 memo not retrospective."
    },
    {
      "case_name": "Rabindra Nath Bose Ors. v. Union of India Ors.",
      "citation": "1970 2 S.C.R. 697",
      "treatment": "followed",
      "relevance": "Dismissal for inordinate delay to protect accrued rights."
    },
    {
      "case_name": "Ramchandra Shankar Deodhar Ors. v. State of Maharashtra Ors.",
      "citation": "1974 1 S.C.C. 317",
      "treatment": "distinguished",
      "relevance": "Delay not absolute bar if no third party rights."
    },
    {
      "case_name": "Union of India v. Vasant Jayaram Karnik Ors.",
      "citation": "A.I.R. 1970 S.C. 2092",
      "treatment": "distinguished",
      "relevance": "Different standards in seniority violate Art 16 only if shown."
    },
    {
      "case_name": "Tilokchand Motichand v. H.B. Munshi",
      "citation": "1969 2 S.C.R. 824",
      "treatment": "followed",
      "relevance": "Move court before other rights emerge."
    },
    {
      "case_name": "Kamini Kumar Das Choudhury v. State of West Bengal Ors.",
      "citation": "A.I.R. 1972 S.C. 2060",
      "treatment": "referred",
      "relevance": "Demand and refusal needed for mandamus."
    },
    {
      "case_name": "D.R. Nim v. Union of India",
      "citation": "1967 2 S.C.R. 325",
      "treatment": "distinguished",
      "relevance": "Arbitrary cut-off date."
    }
  ],
  "statutes_cited": [
    {
      "name": "Constitution of India",
      "sections": [
        "Article 16",
        "Article 32"
      ],
      "relevance": "Equality in employment; direct enforcement of fundamental rights."
    }
  ],
  "outcome": {
    "disposition": "dismissed",
    "summary": "Writ petitions dismissed for failure to establish Article 16 violation, lack of specificity, and inordinate delay creating equitable rights for juniors; 1972 memo upheld as validly implementing Ravi Varma without disturbing past confirmations/promotions.",
    "relief_granted": "None",
    "costs": null
  },
  "key_quotes": [
    {
      "text": "\"The equality of opportunity in a matter relating to employment implies equal treatment to persons similarly situated or in the same category as the petitioner.\"",
      "speaker": "court",
      "significance": "Defines scope of Article 16(1) requiring specific unjust denial."
    },
    {
      "text": "\"It would be unjust to deprive the respondents of the rights which have accrued to them. Each person ought to be entitled to sit back and consider that this appointment and promotion effected a long time ago would not be set aside.\"",
      "speaker": "court",
      "significance": "Justifies dismissal on laches per Rabindra Nath Bose."
    }
  ],
  "_case_id": "1974_353",
  "_label": 0,
  "_text_length": 52528,
  "_extracted_at": "2026-02-10T20:06:15.928148"
}