{
  "metadata": {
    "case_name": "Insurance Company v. Common Carrier",
    "case_year": 1974,
    "court": "Supreme Court of India",
    "judges": [
      "Mathew, J."
    ],
    "case_number": "Civil Appeal No. 535 of 1974",
    "date_of_judgment": null
  },
  "facts": [
    {
      "id": "f1",
      "text": "Appellant is a company doing business in general insurance. Respondent carries on business as a common carrier of goods.",
      "type": "background",
      "date": null,
      "source": "court"
    },
    {
      "id": "f2",
      "text": "Respondent took out three transit policies of insurance renewable every year from appellant. Relevant policy is freight policy No. CL1/RE-P/257 taken in January 1969 against risk of loss or damage to goods during transit.",
      "type": "background",
      "date": "1969-01",
      "source": "court"
    },
    {
      "id": "f3",
      "text": "In June 1971, respondent declared consignment of 185 packages of general merchandise worth approx. Rs. 1,10,000 for transit from Calcutta to Assam and Tripura, paid premium, goods insured under policy.",
      "type": "material",
      "date": "1971-06",
      "source": "respondent"
    },
    {
      "id": "f4",
      "text": "On evening of 29-6-71, consignment loaded in Truck No. WGH-8261, truck left Calcutta for Gauhati. Owner informed respondent of robbery after reaching Barasat on night of 29-6-71; truck, driver, merchandise not traced.",
      "type": "disputed",
      "date": "1971-06-29",
      "source": "respondent"
    },
    {
      "id": "f5",
      "text": "On 1-7-1971, respondent sent letters to Jarabagan Police Station, Assistant Commissioner of Police Intelligence Branch Lall Bazar, Deputy Commissioner of Police Intelligence Branch about truck not reaching Beniagram, truck/driver/merchandise untraced. Copy to appellant received by appellant on 2-7-1971.",
      "type": "procedural",
      "date": "1971-07-01",
      "source": "respondent"
    },
    {
      "id": "f6",
      "text": "On 1-7-1971 and 21-9-1971, respondent lodged claim for loss with appellant.",
      "type": "procedural",
      "date": "1971-07-01",
      "source": "respondent"
    },
    {
      "id": "f7",
      "text": "On 3-7-1971, appellant asked respondent for particulars: name/address of vehicle owner, driver etc.",
      "type": "procedural",
      "date": "1971-07-03",
      "source": "appellant"
    },
    {
      "id": "f8",
      "text": "On 21-9-1971, respondent informed appellant that info supplied to appellant's agent Mr. A.L. Chopra on 5-7-1971.",
      "type": "procedural",
      "date": "1971-09-21",
      "source": "respondent"
    },
    {
      "id": "f9",
      "text": "On 10-10-1971, appellant wrote that without police investigation report, cannot proceed.",
      "type": "procedural",
      "date": "1971-10-10",
      "source": "appellant"
    },
    {
      "id": "f10",
      "text": "Appellant received copy of Barasat police investigation report on 12-5-1972 stating alleged robbery was false.",
      "type": "material",
      "date": "1972-05-12",
      "source": "appellant"
    },
    {
      "id": "f11",
      "text": "On 4-8-1972, appellant sent letter stating contents of Barasat report, asked for Jarabagan/Lall Bazar reports.",
      "type": "procedural",
      "date": "1972-08-04",
      "source": "appellant"
    },
    {
      "id": "f12",
      "text": "On 16-2-1973, appellant disclaimed liability under policy for loss of consignment.",
      "type": "material",
      "date": "1973-02-16",
      "source": "appellant"
    },
    {
      "id": "f13",
      "text": "On 30-3-1973, respondent asked for grounds of disclaimer.",
      "type": "procedural",
      "date": "1973-03-30",
      "source": "respondent"
    },
    {
      "id": "f14",
      "text": "On 30-5-1973, appellant replied nothing to add to 16-2-1973 letter.",
      "type": "procedural",
      "date": "1973-05-30",
      "source": "appellant"
    },
    {
      "id": "f15",
      "text": "Respondent had dealings with appellant since 1958, no prior claim rejected.",
      "type": "background",
      "date": null,
      "source": "respondent"
    },
    {
      "id": "f16",
      "text": "First week June 1973, respondent gave papers to solicitors M/s. Banerji & Co. for arbitration steps.",
      "type": "procedural",
      "date": "1973-06",
      "source": "respondent"
    },
    {
      "id": "f17",
      "text": "On or about 15-6-1973, solicitors opined appellant's disclaimer vague, might rely on clause 12; advised nominate arbitrator due to appellant's delay.",
      "type": "procedural",
      "date": "1973-06-15",
      "source": "respondent"
    },
    {
      "id": "f18",
      "text": "28-6-1973, solicitors briefed counsel for opinion.",
      "type": "procedural",
      "date": "1973-06-28",
      "source": "respondent"
    },
    {
      "id": "f19",
      "text": "16-7-1973, counsel opined apply for extension under s.37(4) Arbitration Act; respondent informed 18-7-1973.",
      "type": "procedural",
      "date": "1973-07-16",
      "source": "respondent"
    },
    {
      "id": "f20",
      "text": "25-7-1973, solicitors sent brief to counsel to draft petition; received 30-7-1973.",
      "type": "procedural",
      "date": "1973-07-25",
      "source": "respondent"
    },
    {
      "id": "f21",
      "text": "17-8-1973, respondent filed application in Calcutta High Court under s.37(4) Arbitration Act for extension of time to refer dispute to arbitration till 15 days after court order.",
      "type": "procedural",
      "date": "1973-08-17",
      "source": "respondent"
    },
    {
      "id": "f22",
      "text": "14-1-1974, Calcutta High Court allowed application, extended time to refer to arbitration within fortnight from that date.",
      "type": "procedural",
      "date": "1974-01-14",
      "source": "lower_court"
    },
    {
      "id": "f23",
      "text": "Respondent filed suit against truck owner in July 1972 for recovery of loss; paid claims to consignors.",
      "type": "background",
      "date": "1972-07",
      "source": "respondent"
    }
  ],
  "legal_issues": [
    {
      "id": "i1",
      "text": "Whether the High Court had power under s.37(4) of the Arbitration Act, 1940 to extend time for referring dispute to arbitration, and if so, whether exercised properly in the circumstances.",
      "framed_by": "court"
    }
  ],
  "petitioner_arguments": [
    {
      "id": "pa1",
      "text": "S.37(4) of the Act had no application, court had no jurisdiction to extend time, and even if jurisdiction, no valid grounds for extension. In circumstances, no undue hardship to respondent if time not extended.",
      "supporting_facts": [
        "f12",
        "f14",
        "f21"
      ],
      "legal_basis": "Clause 12 of policy; s.37(4) Arbitration Act"
    }
  ],
  "respondent_arguments": [
    {
      "id": "ra1",
      "text": "Reasons for delay after receiving disclaimer letter: sought specific grounds, consulted solicitors and counsel; appellant's vague disclaimer and delay contributed.",
      "supporting_facts": [
        "f13",
        "f14",
        "f16",
        "f17",
        "f18",
        "f19",
        "f20"
      ],
      "legal_basis": "s.37(4) Arbitration Act"
    }
  ],
  "court_reasoning": [
    {
      "id": "cr1",
      "text": "Clause 12 of policy deems claim abandoned if not referred to arbitration within 3 months of disclaimer. S.37(4) allows extension if undue hardship otherwise caused.",
      "addresses_issue": "i1",
      "key_observation": "English precedents interpret 'undue hardship' liberally: consider delay extent, fault, amount at stake, prejudice to other side."
    },
    {
      "id": "cr2",
      "text": "Respondent's conduct reasonable: prompt claims, police intimation, inquired grounds of rejection, consulted lawyers promptly after final vague reply. No prior rejections in long dealings. Barasat report doesn't prove fraud; suits filed show bonafides.",
      "addresses_issue": "i1",
      "key_observation": "No material prejudice to appellant; amount at stake high, delay reasons valid, consequences disproportionate to any fault."
    },
    {
      "id": "cr3",
      "text": "High Court exercised discretion properly; appeal dismissed but further time extended to appellant for arbitrator nomination.",
      "addresses_issue": "i1",
      "key_observation": "Undue hardship if not extended."
    }
  ],
  "holdings": [
    {
      "id": "h1",
      "text": "High Court had jurisdiction under s.37(4) and properly exercised discretion to extend time as undue hardship would be caused otherwise.",
      "resolves_issue": "i1",
      "in_favor_of": "respondent"
    }
  ],
  "precedents_cited": [
    {
      "case_name": "Steamship Co. of 1912 etc. v. Indo-American Grain Co. etc.",
      "citation": "1958 2 Lloyds Rep. 341",
      "treatment": "referred",
      "relevance": "Strict view: must be very special circumstances for extension beyond ordinary hardship."
    },
    {
      "case_name": "Watney, Comba, Reid Co. v. E. A. L. Dover Co. Ltd.",
      "citation": "1956 2 Lloyds Rep. 129, 131",
      "treatment": "referred",
      "relevance": "Mere barring of claim not undue hardship; court cannot remove contractual bar."
    },
    {
      "case_name": "F.E. Hookway Co. Ltd. v. H.W.H. Hopper Co.",
      "citation": "1950 2 All E.R. 842",
      "treatment": "referred",
      "relevance": "Delay not claimant's fault = undue hardship; consider sub-contract losses."
    },
    {
      "case_name": "Stanhope Steamship Co. Ltd. v. British Phosphate Commissioners",
      "citation": "1956 2 Lloyds Rep. 325",
      "treatment": "referred",
      "relevance": "Undue hardship if oppressive/out of proportion to fault; amount and delay reasons material."
    },
    {
      "case_name": "Liberian Shipping etc. v. A King & Sons",
      "citation": "1967 1 All E.R. 934",
      "treatment": "followed",
      "relevance": "Liberal view of undue hardship: excusable inadvertence, no prejudice, even if claimant's fault if disproportionate; list factors like blame, amount, delay length, prejudice."
    }
  ],
  "statutes_cited": [
    {
      "name": "Arbitration Act, 1940",
      "sections": [
        "Section 37(4)"
      ],
      "relevance": "Court may extend time for arbitration if undue hardship otherwise caused, notwithstanding expiry."
    }
  ],
  "outcome": {
    "disposition": "dismissed",
    "summary": "Appeal dismissed; High Court's order extending time upheld. Further time of one month from judgment date extended to appellant to nominate arbitrator.",
    "relief_granted": "Time extended for arbitration reference.",
    "costs": null
  },
  "key_quotes": [
    {
      "text": "\"Undue must mean something which is not merited by the conduct of the claimant, or is very much disproportionate to it.\"",
      "speaker": "court",
      "significance": "Defines 'undue hardship' per English precedents."
    },
    {
      "text": "\"We do not think that any material prejudice would be caused to the appellant by extending the time. There would be undue hardship if time is not extended.\"",
      "speaker": "court",
      "significance": "Core finding justifying extension."
    }
  ],
  "_case_id": "1974_363",
  "_label": 0,
  "_text_length": 24445,
  "_extracted_at": "2026-02-10T20:06:51.161609"
}