{
  "metadata": {
    "case_name": "Ram Bali Rajbhar v. Commissioner of Police, Calcutta & Ors.",
    "case_year": 1974,
    "court": "Supreme Court of India",
    "judges": [
      "BEG, J."
    ],
    "case_number": "Writ Petition No. 322 of 1974",
    "date_of_judgment": null
  },
  "facts": [
    {
      "id": "f1",
      "text": "On 5-9-1973 at about 17-40 hrs., petitioner along with associates armed with iron rods, lathis and bombs created disturbance by hurling bombs at tea-stall of Lal Mohan Jadav at 19, Coal Berth, Calcutta, as he refused to supply tea without payment, endangering lives, causing panic, closure of shops, suspension of traffic.",
      "type": "material",
      "date": "1973-09-05",
      "source": "respondent"
    },
    {
      "id": "f2",
      "text": "On 7-9-1973 at about 20.05 hrs., petitioner along with associates armed with iron-rods, lathis and bombs attacked watch repairing shop of Sk. Azim at 52, Circular Garden Reach Road, Calcutta, by hurling bombs and damaging property as owner refused to pay for drinks; hurled bombs at interveners.",
      "type": "material",
      "date": "1973-09-07",
      "source": "respondent"
    },
    {
      "id": "f3",
      "text": "Detention order issued by Commissioner of Police, Calcutta on 1-10-1973; grounds served same day.",
      "type": "procedural",
      "date": "1973-10-01",
      "source": "respondent"
    },
    {
      "id": "f4",
      "text": "Petitioner discharged by Criminal Court on 1-10-1973.",
      "type": "procedural",
      "date": "1973-10-01",
      "source": "court"
    },
    {
      "id": "f5",
      "text": "First representation received by State Government on 18-10-1973.",
      "type": "procedural",
      "date": "1973-10-18",
      "source": "respondent"
    },
    {
      "id": "f6",
      "text": "Detention order approved by State Government on 22-10-1973.",
      "type": "procedural",
      "date": "1973-10-22",
      "source": "respondent"
    },
    {
      "id": "f7",
      "text": "Case sent to Advisory Board on 23-10-1973 with grounds, representation, and report under Sec. 3(3).",
      "type": "procedural",
      "date": "1973-10-23",
      "source": "respondent"
    },
    {
      "id": "f8",
      "text": "Advisory Board gave opinion of sufficient cause on 5-11-1973.",
      "type": "procedural",
      "date": "1973-11-05",
      "source": "respondent"
    },
    {
      "id": "f9",
      "text": "Detention confirmed by State Government on 8-11-1973, served on petitioner on 14-11-1973.",
      "type": "procedural",
      "date": "1973-11-08",
      "source": "respondent"
    },
    {
      "id": "f10",
      "text": "Lal Mohan Jadav swore affidavit on 20-11-1973 stating petitioner did not participate in attack on his shop on 5-9-1973.",
      "type": "disputed",
      "date": "1973-11-20",
      "source": "petitioner"
    },
    {
      "id": "f11",
      "text": "Second representation made by petitioner on 27-11-1973, received by State Government on 28-11-1973, still under consideration.",
      "type": "procedural",
      "date": "1973-11-27",
      "source": "petitioner"
    },
    {
      "id": "f12",
      "text": "Calcutta High Court rejected Habeas Corpus petition on 21-3-1974.",
      "type": "procedural",
      "date": "1974-03-21",
      "source": "court"
    },
    {
      "id": "f13",
      "text": "Kamal Singh Tiger, with identical grounds, released by Advisory Board after personal hearing, finding no sufficient cause.",
      "type": "background",
      "date": null,
      "source": "petitioner"
    },
    {
      "id": "f14",
      "text": "Petitioner holds licence for money lending and has address in Calcutta, described as homeless in grounds.",
      "type": "disputed",
      "date": null,
      "source": "petitioner"
    },
    {
      "id": "f15",
      "text": "Criminal prosecution launched against petitioner on 6-9-1973 for 5-9-1973 incident.",
      "type": "procedural",
      "date": "1973-09-06",
      "source": "court"
    }
  ],
  "legal_issues": [
    {
      "id": "i1",
      "text": "Whether grounds of detention are vague, false, mala fide, and lack rational nexus with maintenance of public order.",
      "framed_by": "petitioner"
    },
    {
      "id": "i2",
      "text": "Whether criminal offences can form basis for preventive detention under MISA, or public order requires threat akin to security of State.",
      "framed_by": "petitioner"
    },
    {
      "id": "i3",
      "text": "Effect of discharge, affidavit by Lal Mohan Jadav, and comparison with Kamal Singh case on validity of detention.",
      "framed_by": "petitioner"
    },
    {
      "id": "i4",
      "text": "Whether detaining authorities and Advisory Board applied their minds properly.",
      "framed_by": "petitioner"
    },
    {
      "id": "i5",
      "text": "Action to be taken on second representation under Section 14 of MISA read with Section 21 of General Clauses Act.",
      "framed_by": "court"
    }
  ],
  "petitioner_arguments": [
    {
      "id": "pa1",
      "text": "Grounds of detention are vague, false, mala fide, fanciful, non-existent; no rational nexus with permissible objects of preventive detention.",
      "supporting_facts": [
        "f1",
        "f2",
        "f10",
        "f14"
      ],
      "legal_basis": "Maintenance of Internal Security Act; public order wider than law and order"
    },
    {
      "id": "pa2",
      "text": "Criminal offences meant for prosecution under ordinary law, not preventive detention; public order must be read with security of State.",
      "supporting_facts": [
        "f1",
        "f2",
        "f15"
      ],
      "legal_basis": "Section 3(a)(ii) MISA"
    },
    {
      "id": "pa3",
      "text": "Detaining authorities did not apply minds: petitioner not homeless, falsely implicated; affidavit by victim exonerates.",
      "supporting_facts": [
        "f10",
        "f13",
        "f14"
      ],
      "legal_basis": null
    },
    {
      "id": "pa4",
      "text": "Kamal Singh with identical grounds released by Advisory Board.",
      "supporting_facts": [
        "f13"
      ],
      "legal_basis": null
    }
  ],
  "respondent_arguments": [
    {
      "id": "ra1",
      "text": "Grounds based on criminal activities jeopardising public order; instances of criminal activity can form basis for detention.",
      "supporting_facts": [
        "f1",
        "f2"
      ],
      "legal_basis": "Haradhan Saha v. State of West Bengal; Golam Hussain v. Commissioner of Police"
    },
    {
      "id": "ra2",
      "text": "Affidavit by Lal Mohan Jadav procured after discharge, dishonest; Commissioner satisfied from enquiries petitioner participated.",
      "supporting_facts": [
        "f3",
        "f10"
      ],
      "legal_basis": null
    },
    {
      "id": "ra3",
      "text": "Kamal Singh case irrelevant; Advisory Board distinguished after personal hearing.",
      "supporting_facts": [
        "f13"
      ],
      "legal_basis": null
    },
    {
      "id": "ra4",
      "text": "Procedural compliance followed; second representation under consideration.",
      "supporting_facts": [
        "f5",
        "f6",
        "f7",
        "f8",
        "f9",
        "f11"
      ],
      "legal_basis": "Sections 3(3), 8, 10, 12 MISA"
    }
  ],
  "court_reasoning": [
    {
      "id": "cr1",
      "text": "Preventive detention different from punitive; can rely on facts subject to prosecution; public order wider than security of State.",
      "addresses_issue": "i2",
      "key_observation": "Criminal instances can justify detention if satisfy need to prevent future disturbance."
    },
    {
      "id": "cr2",
      "text": "Not substituting opinion for detaining authorities unless no reasonable person could be satisfied.",
      "addresses_issue": "i1",
      "key_observation": "Facts show jeopardy to public order."
    },
    {
      "id": "cr3",
      "text": "Affidavit post-dates initial detention and Advisory Board opinion; cannot vitiate order.",
      "addresses_issue": "i3",
      "key_observation": "High Court rightly held affidavit does not affect initial order."
    },
    {
      "id": "cr4",
      "text": "Kamal Singh distinguishable as he got personal hearing and persuaded Board.",
      "addresses_issue": "i3",
      "key_observation": "Board applied mind differently."
    },
    {
      "id": "cr5",
      "text": "No evidence of non-application of mind or mala fides; no denial of personal hearing or effective representation.",
      "addresses_issue": "i4",
      "key_observation": "Petitioner must show violation of Art. 21/22."
    },
    {
      "id": "cr6",
      "text": "Under Sec. 14 MISA r/w Sec. 21 General Clauses Act, State can revoke/modify; advisable to refer second representation to Advisory Board.",
      "addresses_issue": "i5",
      "key_observation": "Implied power to refer subsequent representations analogously."
    }
  ],
  "holdings": [
    {
      "id": "h1",
      "text": "Preventive detention valid despite criminal prosecution/discharge; grounds sufficient for public order.",
      "resolves_issue": "i1",
      "in_favor_of": "respondent"
    },
    {
      "id": "h2",
      "text": "Public order elastic concept wider than security of State; criminal acts can justify if threaten public order.",
      "resolves_issue": "i2",
      "in_favor_of": "respondent"
    },
    {
      "id": "h3",
      "text": "State Government to consider second representation early, possibly referring to Advisory Board under Sec. 14.",
      "resolves_issue": "i5",
      "in_favor_of": "partial"
    }
  ],
  "precedents_cited": [
    {
      "case_name": "Golam Hussain alias Gama v. Commissioner of Police, Calcutta & Ors.",
      "citation": "1974 4 SCC p.530",
      "treatment": "followed",
      "relevance": "Criminal activity can form basis for detention satisfaction."
    },
    {
      "case_name": "Milan Banik v. State of West Bengal & Ors.",
      "citation": "AIR 1972 SC 1214",
      "treatment": "followed",
      "relevance": "Criminal activity can form basis for detention satisfaction."
    },
    {
      "case_name": "Mohd Salim Khan v. Shri C.C. Base & Anr.",
      "citation": "AIR 1972 SC 1670",
      "treatment": "followed",
      "relevance": "Criminal activity can form basis for detention satisfaction."
    },
    {
      "case_name": "Sasti Satish Chowdhary v. State of West Bengal",
      "citation": "1973 1 SCR 467",
      "treatment": "followed",
      "relevance": "Criminal activity can form basis for detention satisfaction."
    },
    {
      "case_name": "Haradhan Saha v. State of West Bengal & Ors.",
      "citation": "AIR 1974 SC 2154",
      "treatment": "followed",
      "relevance": "Preventive detention qualitative different; not parallel to prosecution; public order wider than State security."
    }
  ],
  "statutes_cited": [
    {
      "name": "Maintenance of Internal Security Act, 1971",
      "sections": [
        "Section 3(a)(ii)",
        "Section 3(2)",
        "Section 3(3)",
        "Section 8",
        "Section 10",
        "Section 11",
        "Section 12",
        "Section 14(1)"
      ],
      "relevance": "Basis for detention order, representations, Advisory Board reference, confirmation, revocation/modification."
    },
    {
      "name": "Constitution of India",
      "sections": [
        "Article 32",
        "Article 21",
        "Article 22",
        "Article 226"
      ],
      "relevance": "Habeas corpus petition; protection of personal liberty."
    },
    {
      "name": "General Clauses Act, 1897",
      "sections": [
        "Section 21"
      ],
      "relevance": "Power to revoke/modify orders; read with Sec. 14 MISA."
    }
  ],
  "outcome": {
    "disposition": "dismissed",
    "summary": "Prayer for quashing detention order rejected; detention held prima facie legal. Directed State Government of West Bengal to consider and decide expeditiously the pending second representation in accordance with law, possibly referring to Advisory Board.",
    "relief_granted": "Direction to consider second representation early.",
    "costs": null
  },
  "key_quotes": [
    {
      "text": "\"The power of preventive detention is qualitatively different from punitive detention. The power of preventive detention is a precautionary power exercised in reasonable anticipation.\"",
      "speaker": "court",
      "significance": "Distinguishes preventive from punitive detention; clarifies reliance on past acts."
    },
    {
      "text": "\"Public Order is necessarily an elastic concept which is, in any case, wider than the security of the State category.\"",
      "speaker": "court",
      "significance": "Defines scope of public order under MISA."
    },
    {
      "text": "\"Courts have, no doubt, to zealously guard the personal liberty of the citizen... But, this does not mean that they have to or can rightly and properly assume either the duties cast upon the detaining authorities and Advisory Board.\"",
      "speaker": "court",
      "significance": "Limits judicial role in preventive detention cases."
    }
  ],
  "_case_id": "1974_357",
  "_label": 0,
  "_text_length": 23181,
  "_extracted_at": "2026-02-10T20:06:48.397955"
}